EpNo,EpTitle,Img1,Img2,Img3,Img4,Eng1,Eng2,Eng3,Eng4,Jap1,Jap2,Jap3,Jap4
1,Dog Cute,0,3,2,8,When my dog is walking+,pooping+,sleeping+,it's always cute!,散歩の時も…,うんちの時も…,寝ている時も…,いつも犬かわいい！
1,Dog CuteII,7,4,5,9,I'm taking a walk with my dog right now.,I'm preparing the dog's food right now.,I'm taking a dog in the bath right now.,Here is the question+What am i doing now?,今、犬と散歩しているよ。,今、犬のごはんの支度をしているよ。,今、犬をお風呂に入れてるよ。,問題です。今、何をしているでしょう？
3,This is a dog,10,11,12,18,Is this a dog?,This is a dog.,Is your dog?,That's my dog.,これは犬ですか？,これは犬です。,あなたの犬ですか？,それ、僕の犬だよ。
4,Travel Abroad,19,20,21,27,I will teach you English to help you travel abroad.,Where is the restroom?,The toilet doesn't work.,When traveling abroad+there are many people who have trouble with toilets.,海外旅行で役立つ英語を教えるよ。,トイレはどこですか？,トイレが故障しています。,海外旅行で、トイレで困る人はとても多いっス。
5,Dog Sayings,28,29,30,36,I will teach you dog sayings.,A barking dog never bites.,Let sleeping dogs lie.,Love me+love my dog.,犬のことわざを教えるよ。,吠える犬は噛みつかない。,眠っている犬を起こすな。,人を愛するならその飼い犬まで。,
6,Dog Dream,37,38,39,44,Go ahead!,I'm shaken off.,Help me.,In my dream+ I'm with my dog.,前へ進め！,振り落とされる～。,助けてー。,夢の中でも、犬と一緒です。